----------------------------------------------------------------------------
CrystalDiskInfo 9.2.2 (C) 2008-2024 hiyohiyo
                                Crystal Dew World: https://crystalmark.info/
----------------------------------------------------------------------------

    OS : Windows 11 Professional [10.0 Build 22631] (x64)
  Date : 2024/01/26 13:56:13

-- Controller Map ----------------------------------------------------------
 + 표준 SATA AHCI 컨트롤러 [ATA]
   - WDC WD40EZRZ-00GXCB0
   - Samsung SSD 850 PRO 512GB
 + UAS(USB Attached SCSI) 대용량 저장 장치 [SCSI]
   - Samsung PSSD T7 Shield SCSI Disk Device
 - Microsoft Storage Spaces Controller [SCSI]
 - Microsoft VHD Loopback Controller [SCSI]

-- Disk List ---------------------------------------------------------------
 (01) Samsung SSD 850 PRO 512GB : 512.1 GB [1/0/0, pd1] - sg
 (02) WDC WD40EZRZ-00GXCB0 : 4000.7 GB [0/0/0, pd1]
 (03) Samsung Portable SSD T7 Shield : 4000.7 GB [3/2/0, na] - nv

----------------------------------------------------------------------------
 (01) Samsung SSD 850 PRO 512GB
----------------------------------------------------------------------------
           Model : Samsung SSD 850 PRO 512GB
        Firmware : EXM02B6Q
   Serial Number : S257NXAG903910Y
       Disk Size : 512.1 GB (8.4/137.4/512.1/512.1)
     Buffer Size : 알 수 없음
     Queue Depth : 32
    # of Sectors : 1000215216
   Rotation Rate : ---- (SSD)
       Interface : Serial ATA
   Major Version : ACS-2
   Minor Version : ATA8-ACS version 4c
   Transfer Mode : SATA/600 | SATA/600
  Power On Hours : 58583 시간
  Power On Count : 3721 회
     Host Writes : 48755 GB
Wear Level Count : 398
     Temperature : 37 C (98 F)
   Health Status : 좋음 (93 %)
        Features : S.M.A.R.T., NCQ, TRIM, DevSleep, GPL
       APM Level : ----
       AAM Level : ----
    Drive Letter : C:

-- S.M.A.R.T. --------------------------------------------------------------
ID Cur Wor Thr RawValues(6) Attribute Name
05 100 100 _10 000000000000 재할당된 섹터 수
09 _88 _88 __0 00000000E4D7 사용 시간
0C _96 _96 __0 000000000E89 사용 횟수
B1 _93 __1 __0 00000000018E 웨어 레벨링 횟수
B3 100 100 _10 000000000000 총 사용된 예비 블록 수
B5 100 100 _10 000000000000 총 쓰기 실패 횟수
B6 100 100 _10 000000000000 총 삭제 실패 횟수
B7 100 100 _10 000000000000 총 런타임 배드 블록 수
BB 100 100 __0 000000000000 회복 불가능한 오류 횟수
BE _63 _49 __0 000000000025 공기 온도
C3 200 200 __0 000000000000 ECC 오류율
C7 _99 _99 __0 000000000001 CRC 오류 횟수
EB _99 _99 __0 000000000042 POR 복구 횟수
F1 _99 _99 __0 0017CE62107D 총 쓰기량 (호스트)

-- IDENTIFY_DEVICE ---------------------------------------------------------
        0    1    2    3    4    5    6    7    8    9
000: 0040 3FFF C837 0010 0000 0000 003F 0000 0000 0000
010: 5332 3537 4E58 4147 3930 3339 3130 5920 2020 2020
020: 0000 0000 0000 4558 4D30 3242 3651 5361 6D73 756E
030: 6720 5353 4420 3835 3020 5052 4F20 3531 3247 4220
040: 2020 2020 2020 2020 2020 2020 2020 8001 4001 2F00
050: 4000 0200 0200 0007 3FFF 0010 003F FC10 00FB 0101
060: FFFF 0FFF 0000 0007 0003 0078 0078 0078 0078 0F10
070: 0000 0000 0000 0000 0000 001F 850E 00C6 016C 0060
080: 03FC 0039 746B 7D01 4163 7469 BC01 4163 407F 0001
090: 0001 0000 FFFE 0000 0000 0000 0000 0000 0000 0000
100: 12B0 3B9E 0000 0000 0000 0008 4000 0000 5002 5388
110: 400A 15E7 0000 0000 0000 0000 0000 0000 0000 401E
120: 401C 0000 0000 0000 0000 0000 0000 0000 0029 0000
130: 0000 0000 0000 0000 0000 0000 0000 0000 0000 0000
140: 0000 0000 0000 0000 0000 0000 0000 0000 0000 0000
150: 0000 0000 0000 0000 0000 0000 0000 0000 0000 0000
160: 0000 0000 0000 0000 0000 0000 0000 0000 0000 0001
170: 2020 2020 2020 2020 0000 0000 0000 0000 0000 0000
180: 0000 0000 0000 0000 0000 0000 0000 0000 0000 0000
190: 0000 0000 0000 0000 0000 0000 0000 0000 0000 0000
200: 0000 0000 0000 0000 0000 0000 003D 0000 0000 4000
210: 0000 0000 0000 0000 0000 0000 0000 0001 0000 0000
220: 0000 0000 107F 0000 0000 0000 0000 0000 0000 0000
230: 0000 0000 0000 0000 0000 0800 0000 0000 0000 0000
240: 0000 0000 0000 4000 0000 0000 0000 0000 0000 0000
250: 0000 0000 0000 0000 0000 65A5

-- SMART_READ_DATA ---------------------------------------------------------
     +0 +1 +2 +3 +4 +5 +6 +7 +8 +9 +A +B +C +D +E +F
000: 01 00 05 33 00 64 64 00 00 00 00 00 00 00 09 32
010: 00 58 58 D7 E4 00 00 00 00 00 0C 32 00 60 60 89
020: 0E 00 00 00 00 00 B1 13 00 5D 01 8E 01 00 00 00
030: 00 00 B3 13 00 64 64 00 00 00 00 00 00 00 B5 32
040: 00 64 64 00 00 00 00 00 00 00 B6 32 00 64 64 00
050: 00 00 00 00 00 00 B7 13 00 64 64 00 00 00 00 00
060: 00 00 BB 32 00 64 64 00 00 00 00 00 00 00 BE 32
070: 00 3F 31 25 00 00 00 00 00 00 C3 1A 00 C8 C8 00
080: 00 00 00 00 00 00 C7 3E 00 63 63 01 00 00 00 00
090: 00 00 EB 12 00 63 63 42 00 00 00 00 00 00 F1 32
0A0: 00 63 63 7D 10 62 CE 17 00 00 00 00 00 00 00 00
0B0: 00 00 00 00 00 00 00 00 00 00 00 00 00 00 00 00
0C0: 00 00 00 00 00 00 00 00 00 00 00 00 00 00 00 00
0D0: 00 00 00 00 00 00 00 00 00 00 00 00 00 00 00 00
0E0: 00 00 00 00 00 00 00 00 00 00 00 00 00 00 00 00
0F0: 00 00 00 00 00 00 00 00 00 00 00 00 00 00 00 00
100: 00 00 00 00 00 00 00 00 00 00 00 00 00 00 00 00
110: 00 00 00 00 00 00 00 00 00 00 00 00 00 00 00 00
120: 00 00 00 00 00 00 00 00 00 00 00 00 00 00 00 00
130: 00 00 00 00 00 00 00 00 00 00 00 00 00 00 00 00
140: 00 00 00 00 00 00 00 00 00 00 00 00 00 00 00 00
150: 00 00 00 00 00 00 00 00 00 00 00 00 00 00 00 00
160: 00 00 00 00 00 00 00 00 00 00 00 00 00 00 00 53
170: 03 00 01 00 02 FF 00 10 01 00 00 00 00 00 00 00
180: 00 00 00 00 00 00 00 00 00 00 00 00 00 00 00 00
190: 00 00 00 00 00 00 00 00 00 00 00 00 00 00 00 00
1A0: 00 00 00 00 00 00 00 00 00 00 00 00 00 00 00 00
1B0: 00 00 00 00 00 00 00 00 00 00 00 00 00 00 00 00
1C0: 00 00 00 00 00 00 00 00 00 00 00 00 00 00 00 00
1D0: 00 00 00 00 00 00 00 00 00 00 00 00 00 00 00 00
1E0: 00 00 00 00 00 00 00 00 00 00 00 00 00 00 00 00
1F0: 00 00 00 00 00 00 00 00 00 00 00 00 00 00 00 F6

-- SMART_READ_THRESHOLD ----------------------------------------------------
     +0 +1 +2 +3 +4 +5 +6 +7 +8 +9 +A +B +C +D +E +F
000: 01 00 05 0A 00 00 00 00 00 00 00 00 00 00 09 00
010: 00 00 00 00 00 00 00 00 00 00 0C 00 00 00 00 00
020: 00 00 00 00 00 00 B1 00 00 00 00 00 00 00 00 00
030: 00 00 B3 0A 00 00 00 00 00 00 00 00 00 00 B5 0A
040: 00 00 00 00 00 00 00 00 00 00 B6 0A 00 00 00 00
050: 00 00 00 00 00 00 B7 0A 00 00 00 00 00 00 00 00
060: 00 00 BB 00 00 00 00 00 00 00 00 00 00 00 BE 00
070: 00 00 00 00 00 00 00 00 00 00 C3 00 00 00 00 00
080: 00 00 00 00 00 00 C7 00 00 00 00 00 00 00 00 00
090: 00 00 EB 00 00 00 00 00 00 00 00 00 00 00 F1 00
0A0: 00 00 00 00 00 00 00 00 00 00 00 00 00 00 00 00
0B0: 00 00 00 00 00 00 00 00 00 00 00 00 00 00 00 00
0C0: 00 00 00 00 00 00 00 00 00 00 00 00 00 00 00 00
0D0: 00 00 00 00 00 00 00 00 00 00 00 00 00 00 00 00
0E0: 00 00 00 00 00 00 00 00 00 00 00 00 00 00 00 00
0F0: 00 00 00 00 00 00 00 00 00 00 00 00 00 00 00 00
100: 00 00 00 00 00 00 00 00 00 00 00 00 00 00 00 00
110: 00 00 00 00 00 00 00 00 00 00 00 00 00 00 00 00
120: 00 00 00 00 00 00 00 00 00 00 00 00 00 00 00 00
130: 00 00 00 00 00 00 00 00 00 00 00 00 00 00 00 00
140: 00 00 00 00 00 00 00 00 00 00 00 00 00 00 00 00
150: 00 00 00 00 00 00 00 00 00 00 00 00 00 00 00 00
160: 00 00 00 00 00 00 00 00 00 00 00 00 00 00 00 00
170: 00 00 00 00 00 00 00 00 00 00 00 00 00 00 00 00
180: 00 00 00 00 00 00 00 00 00 00 00 00 00 00 00 00
190: 00 00 00 00 00 00 00 00 00 00 00 00 00 00 00 00
1A0: 00 00 00 00 00 00 00 00 00 00 00 00 00 00 00 00
1B0: 00 00 00 00 00 00 00 00 00 00 00 00 00 00 00 00
1C0: 00 00 00 00 00 00 00 00 00 00 00 00 00 00 00 00
1D0: 00 00 00 00 00 00 00 00 00 00 00 00 00 00 00 00
1E0: 00 00 00 00 00 00 00 00 00 00 00 00 00 00 00 00
1F0: 00 00 00 00 00 00 00 00 00 00 00 00 00 00 00 4E

----------------------------------------------------------------------------
 (02) WDC WD40EZRZ-00GXCB0
----------------------------------------------------------------------------
           Model : WDC WD40EZRZ-00GXCB0
        Firmware : 80.00A80
   Serial Number : WD-WCC7K3CC3SPJ
       Disk Size : 4000.7 GB (8.4/137.4/4000.7/4000.7)
     Buffer Size : 알 수 없음
     Queue Depth : 32
    # of Sectors : 7814037168
   Rotation Rate : 5400 RPM
       Interface : Serial ATA
   Major Version : ACS-3
   Minor Version : ACS-3 Revision 5
   Transfer Mode : SATA/600 | SATA/600
  Power On Hours : 10663 시간
  Power On Count : 3362 회
     Temperature : 27 C (80 F)
   Health Status : 좋음
        Features : S.M.A.R.T., NCQ, GPL
       APM Level : ----
       AAM Level : ----
    Drive Letter : D:

-- S.M.A.R.T. --------------------------------------------------------------
ID Cur Wor Thr RawValues(6) Attribute Name
01 200 200 _51 000000000000 읽기 오류율
03 182 163 _21 0000000016FB 스핀 업 시간
04 _89 _89 __0 000000002B8C 시작/정지 횟수
05 200 200 140 000000000000 재할당된 섹터 수
07 200 200 __0 000000000000 탐색 오류율
09 _86 _86 __0 0000000029A7 사용 시간
0A 100 100 __0 000000000000 스핀 재시도 횟수
0B 100 100 __0 000000000000 교정 재시도 횟수
0C _97 _97 __0 000000000D22 사용 횟수
C0 200 200 __0 00000000003B 전원 차단에 의한 자기 헤드 대피 횟수
C1 190 190 __0 000000007F26 로드/언로드 사이클 횟수
C2 123 107 __0 00000000001B 온도
C4 200 200 __0 000000000000 재할당된 이벤트 수
C5 200 200 __0 000000000000 보류 중인 섹터 수
C6 200 200 __0 000000000000 회복 불가능 섹터 수
C7 200 200 __0 000000000002 울트라 DMA CRC 오류 횟수
C8 200 200 __0 000000000000 쓰기 오류율

-- IDENTIFY_DEVICE ---------------------------------------------------------
        0    1    2    3    4    5    6    7    8    9
000: 427A 3FFF C837 0010 0000 0000 003F 0000 0000 0000
010: 2020 2020 2057 442D 5743 4337 4B33 4343 3353 504A
020: 0000 0000 0000 3830 2E30 3041 3830 5744 4320 5744
030: 3430 455A 525A 2D30 3047 5843 4230 2020 2020 2020
040: 2020 2020 2020 2020 2020 2020 2020 8010 4000 2F00
050: 4001 0000 0000 0006 3FFF 0010 003F FC10 00FB 0110
060: FFFF 0FFF 0000 0107 0003 0078 0078 0078 0078 0D00
070: 0000 0000 0000 0000 0000 001F 970E 0006 004C 0040
080: 07FE 006D 746B 7D61 4123 7469 BC41 4123 007F 80F4
090: 80F4 0000 FFFE 0000 0000 0000 0000 0000 0000 0000
100: BEB0 D1C0 0001 0000 0000 0000 6003 0000 5001 4EE2
110: 10A7 E775 0000 0000 0000 0000 0000 0000 0000 401C
120: 401C 0000 0000 0000 0000 0000 0000 0000 0029 0000
130: 0000 0000 0000 0000 0000 0000 0000 0000 0000 0000
140: 0000 0000 0004 0000 0000 0000 0000 0000 0000 0000
150: 0000 0000 0000 0000 0000 0000 0000 0000 0000 0000
160: 0000 0000 0000 0000 0000 0000 0000 0000 0002 0000
170: 0000 0000 0000 0000 0000 0000 0000 0000 0000 0000
180: 0000 0000 0000 0000 0000 0000 0000 0000 0000 0000
190: 0000 0000 0000 0000 0000 0000 0000 0000 0000 0000
200: 0000 0000 0000 0000 0000 0000 3035 0000 0000 4000
210: 0000 0000 0000 0000 0000 0000 0000 1518 0000 0000
220: 0000 0000 107E 0000 0000 0000 0000 0000 0000 0000
230: 0000 0000 0000 0000 0001 2800 0000 0000 0000 0000
240: 0000 0000 0000 0000 0000 0000 0000 0000 0000 0000
250: 0000 0000 0000 0000 0000 4AA5

-- SMART_READ_DATA ---------------------------------------------------------
     +0 +1 +2 +3 +4 +5 +6 +7 +8 +9 +A +B +C +D +E +F
000: 10 00 01 2F 00 C8 C8 00 00 00 00 00 00 00 03 27
010: 00 B6 A3 FB 16 00 00 00 00 00 04 32 00 59 59 8C
020: 2B 00 00 00 00 00 05 33 00 C8 C8 00 00 00 00 00
030: 00 00 07 2E 00 C8 C8 00 00 00 00 00 00 00 09 32
040: 00 56 56 A7 29 00 00 00 00 00 0A 32 00 64 64 00
050: 00 00 00 00 00 00 0B 32 00 64 64 00 00 00 00 00
060: 00 00 0C 32 00 61 61 22 0D 00 00 00 00 00 C0 32
070: 00 C8 C8 3B 00 00 00 00 00 00 C1 32 00 BE BE 26
080: 7F 00 00 00 00 00 C2 22 00 7B 6B 1B 00 00 00 00
090: 00 00 C4 32 00 C8 C8 00 00 00 00 00 00 00 C5 32
0A0: 00 C8 C8 00 00 00 00 00 00 00 C6 30 00 C8 C8 00
0B0: 00 00 00 00 00 00 C7 32 00 C8 C8 02 00 00 00 00
0C0: 00 00 C8 08 00 C8 C8 00 00 00 00 00 00 00 00 00
0D0: 00 00 00 00 00 00 00 00 00 00 00 00 00 00 00 00
0E0: 00 00 00 00 00 00 00 00 00 00 00 00 00 00 00 00
0F0: 00 00 00 00 00 00 00 00 00 00 00 00 00 00 00 00
100: 00 00 00 00 00 00 00 00 00 00 00 00 00 00 00 00
110: 00 00 00 00 00 00 00 00 00 00 00 00 00 00 00 00
120: 00 00 00 00 00 00 00 00 00 00 00 00 00 00 00 00
130: 00 00 00 00 00 00 00 00 00 00 00 00 00 00 00 00
140: 00 00 00 00 00 00 00 00 00 00 00 00 00 00 00 00
150: 00 00 00 00 00 00 00 00 00 00 00 00 00 00 00 00
160: 00 00 00 00 00 00 00 00 00 00 82 00 60 AE 01 7B
170: 03 00 01 00 02 FF 05 D9 01 00 00 00 00 00 00 00
180: 00 00 01 06 00 00 00 00 00 00 00 00 00 00 00 00
190: 00 00 00 00 00 00 00 00 00 00 00 00 00 00 00 00
1A0: 00 00 00 00 00 00 00 00 00 00 00 00 00 00 00 00
1B0: 00 00 00 00 00 00 00 00 00 00 00 00 00 00 00 00
1C0: 00 00 00 00 00 00 00 00 00 00 00 00 00 00 00 00
1D0: 00 00 00 00 00 00 00 00 00 00 00 00 00 00 00 00
1E0: 00 00 00 00 00 00 00 00 00 00 00 00 00 00 00 00
1F0: 00 00 00 00 00 00 00 00 00 00 00 00 00 00 00 56

-- SMART_READ_THRESHOLD ----------------------------------------------------
     +0 +1 +2 +3 +4 +5 +6 +7 +8 +9 +A +B +C +D +E +F
000: 10 00 01 33 C8 C8 C8 C8 C8 C8 00 00 00 00 03 15
010: 00 00 00 00 00 00 00 00 00 00 04 00 00 00 00 00
020: 00 00 00 00 00 00 05 8C 00 00 00 00 00 00 00 00
030: 00 00 07 00 C8 C8 C8 C8 C8 C8 00 00 00 00 09 00
040: 00 00 00 00 00 00 00 00 00 00 0A 00 00 00 00 00
050: 00 00 00 00 00 00 0B 00 00 00 00 00 00 00 00 00
060: 00 00 0C 00 00 00 00 00 00 00 00 00 00 00 C0 00
070: 00 00 00 00 00 00 00 00 00 00 C1 00 00 00 00 00
080: 00 00 00 00 00 00 C2 00 00 00 00 00 00 00 00 00
090: 00 00 C4 00 00 00 00 00 00 00 00 00 00 00 C5 00
0A0: 00 00 00 00 00 00 00 00 00 00 C6 00 00 00 00 00
0B0: 00 00 00 00 00 00 C7 00 00 00 00 00 00 00 00 00
0C0: 00 00 C8 00 C8 C8 C8 C8 C8 C8 00 00 00 00 00 00
0D0: 00 00 00 00 00 00 00 00 00 00 00 00 00 00 00 00
0E0: 00 00 00 00 00 00 00 00 00 00 00 00 00 00 00 00
0F0: 00 00 00 00 00 00 00 00 00 00 00 00 00 00 00 00
100: 00 00 00 00 00 00 00 00 00 00 00 00 00 00 00 00
110: 00 00 00 00 00 00 00 00 00 00 00 00 00 00 00 00
120: 00 00 00 00 00 00 00 00 00 00 00 00 00 00 00 00
130: 00 00 00 00 00 00 00 00 00 00 00 00 00 00 00 00
140: 00 00 00 00 00 00 00 00 00 00 00 00 00 00 00 00
150: 00 00 00 00 00 00 00 00 00 00 00 00 00 00 00 00
160: 00 00 00 00 00 00 00 00 00 00 82 00 60 AE 01 7B
170: 03 00 01 00 02 FF 05 D9 01 00 00 00 00 00 00 00
180: 00 00 01 06 00 00 00 00 00 00 00 00 00 00 00 00
190: 00 00 00 00 00 00 00 00 00 00 00 00 00 00 00 00
1A0: 00 00 00 00 00 00 00 00 00 00 00 00 00 00 00 00
1B0: 00 00 00 00 00 00 00 00 00 00 00 00 00 00 00 00
1C0: 00 00 00 00 00 00 00 00 00 00 00 00 00 00 00 00
1D0: 00 00 00 00 00 00 00 00 00 00 00 00 00 00 00 00
1E0: 00 00 00 00 00 00 00 00 00 00 00 00 00 00 00 00
1F0: 00 00 00 00 00 00 00 00 00 00 00 00 00 00 00 B6

----------------------------------------------------------------------------
 (03) Samsung Portable SSD T7 Shield
----------------------------------------------------------------------------
           Model : Samsung Portable SSD T7 Shield
        Firmware : FXI72P2Q
   Serial Number : S6SGNJ0W900011W
       Disk Size : 4000.7 GB
       Interface : UASP (NVM Express)
        Standard : NVM Express 1.4
   Transfer Mode : ---- | ----
  Power On Hours : 2088 시간
  Power On Count : 52 회
      Host Reads : 3051 GB
     Host Writes : 4541 GB
     Temperature : 28 C (82 F)
   Health Status : 좋음 (100 %)
        Features : S.M.A.R.T., TRIM, VolatileWriteCache
    Drive Letter : E:

-- S.M.A.R.T. --------------------------------------------------------------
ID RawValues(6) Attribute Name
01 000000000000 치명적 경고
02 00000000012D 복합 온도
03 000000000064 사용 가능한 예비 영역
04 00000000000A 최소 사용 가능한 예비 영역
05 000000000000 사용률
06 00000061A938 총 읽기량 (호스트)
07 0000009157DD 총 쓰기량 (호스트)
08 0000022BDE42 처리된 읽기 명령 횟수 (호스트)
09 000003331B60 처리된 쓰기 명령 횟수 (호스트)
0A 0000000000EB 컨트롤러 바쁜 시간
0B 000000000034 사용 횟수
0C 000000000828 사용 시간
0D 000000000015 예기치 않은 전원 손실 횟수
0E 000000000000 매체/데이터 무결성 오류 횟수
0F 000000000000 오류 정보 기록 항목 수

-- IDENTIFY_DEVICE ---------------------------------------------------------
        0    1    2    3    4    5    6    7    8    9
000: 144D 144D 3653 4753 4A4E 5730 3039 3030 3131 2057
010: 2020 2020 6153 736D 6E75 2067 6F50 7472 6261 656C
020: 5320 4453 5420 2037 6853 6569 646C 2020 2020 2020
030: 2020 2020 5846 3749 5032 5132 3802 0025 0900 0005
040: 0400 0001 A120 0007 1200 007A 0200 0000 0000 0000
050: 0000 0000 0000 0000 0000 0100 0000 0000 0000 0000
060: 0000 0000 0000 0000 0000 0000 0000 0000 0000 0000
070: 0000 0000 0000 0000 0000 0000 0000 0000 0000 0000
080: 0000 0000 0000 0000 0000 0000 0000 0000 0000 0000
090: 0000 0000 0000 0000 0000 0000 0000 0000 0000 0000
100: 0000 0000 0000 0000 0000 0000 0000 0000 0000 0000
110: 0000 0000 0000 0000 0000 0000 0000 0000 0000 0000
120: 0000 0000 0000 0000 0000 0000 0000 0000 0007 0307
130: 0F16 033F 0101 015C 0161 0000 0000 0000 0000 0000
140: 6000 817D 03A3 0000 0000 0000 0000 0000 0000 0000
150: 0000 0000 0000 0000 0000 0000 0000 0000 0000 0400
160: 0000 0000 0000 0000 0003 6000 0000 0000 0000 0000
170: 0000 0000 0000 0000 0000 0000 0000 0000 0000 0000
180: 0000 0000 0000 0000 0000 0000 0000 0000 0000 0000
190: 0000 0000 0000 0000 0000 0000 0000 0000 0000 0000
200: 0000 0000 0000 0000 0000 0000 0000 0000 0000 0000
210: 0000 0000 0000 0000 0000 0000 0000 0000 0000 0000
220: 0000 0000 0000 0000 0000 0000 0000 0000 0000 0000
230: 0000 0000 0000 0000 0000 0000 0000 0000 0000 0000
240: 0000 0000 0000 0000 0000 0000 0000 0000 0000 0000
250: 0000 0000 0000 0000 0000 0000

-- SMART_NVME --------------------------------------------------------------
     +0 +1 +2 +3 +4 +5 +6 +7 +8 +9 +A +B +C +D +E +F
000: 00 2D 01 64 0A 00 00 00 00 00 00 00 00 00 00 00
010: 00 00 00 00 00 00 00 00 00 00 00 00 00 00 00 00
020: 38 A9 61 00 00 00 00 00 00 00 00 00 00 00 00 00
030: DD 57 91 00 00 00 00 00 00 00 00 00 00 00 00 00
040: 42 DE 2B 02 00 00 00 00 00 00 00 00 00 00 00 00
050: 60 1B 33 03 00 00 00 00 00 00 00 00 00 00 00 00
060: EB 00 00 00 00 00 00 00 00 00 00 00 00 00 00 00
070: 34 00 00 00 00 00 00 00 00 00 00 00 00 00 00 00
080: 28 08 00 00 00 00 00 00 00 00 00 00 00 00 00 00
090: 15 00 00 00 00 00 00 00 00 00 00 00 00 00 00 00
0A0: 00 00 00 00 00 00 00 00 00 00 00 00 00 00 00 00
0B0: 00 00 00 00 00 00 00 00 00 00 00 00 00 00 00 00
0C0: 00 00 00 00 00 00 00 00 2D 01 2F 01 00 00 00 00
0D0: 00 00 00 00 00 00 00 00 00 00 00 00 00 00 00 00
0E0: 00 00 00 00 00 00 00 00 00 00 00 00 00 00 00 00
0F0: 00 00 00 00 00 00 00 00 00 00 00 00 00 00 00 00
100: 00 00 00 00 00 00 00 00 00 00 00 00 00 00 00 00
110: 00 00 00 00 00 00 00 00 00 00 00 00 00 00 00 00
120: 00 00 00 00 00 00 00 00 00 00 00 00 00 00 00 00
130: 00 00 00 00 00 00 00 00 00 00 00 00 00 00 00 00
140: 00 00 00 00 00 00 00 00 00 00 00 00 00 00 00 00
150: 00 00 00 00 00 00 00 00 00 00 00 00 00 00 00 00
160: 00 00 00 00 00 00 00 00 00 00 00 00 00 00 00 00
170: 00 00 00 00 00 00 00 00 00 00 00 00 00 00 00 00
180: 00 00 00 00 00 00 00 00 00 00 00 00 00 00 00 00
190: 00 00 00 00 00 00 00 00 00 00 00 00 00 00 00 00
1A0: 00 00 00 00 00 00 00 00 00 00 00 00 00 00 00 00
1B0: 00 00 00 00 00 00 00 00 00 00 00 00 00 00 00 00
1C0: 00 00 00 00 00 00 00 00 00 00 00 00 00 00 00 00
1D0: 00 00 00 00 00 00 00 00 00 00 00 00 00 00 00 00
1E0: 00 00 00 00 00 00 00 00 00 00 00 00 00 00 00 00
1F0: 00 00 00 00 00 00 00 00 00 00 00 00 00 00 00 00

